sentence	sentence_id	locale	reason
SI bu kararıyla iddiayı kaybetmiş göründü.	d2487593f36f391a5acdcc9b3a35bc076634d4ac57bb9fc204dcc59c143d938b	tr	grammar-or-spelling
SI bu kararıyla iddiayı kaybetmiş göründü.	d2487593f36f391a5acdcc9b3a35bc076634d4ac57bb9fc204dcc59c143d938b	tr	difficult-pronounce
Ancak gerçek oran kuskusuz daha yüksek.	c3b475bcff0257f14fafdac16c3da009020eb360466313cfd92e94d864c053aa	tr	grammar-or-spelling
Bölgede yenilenen işbirliği çözüme katkıda bulunaabilir mi?	1c5acf73c4a9b45327fa6a8651a91768249bd8b1f567a75ec371f77f71d7af04	tr	grammar-or-spelling
Mahhemenin altı ay sürmesi bekleniyor.	15ed9f716915a81cc2033d925ddae80bf99f87c796db659a44fb93d26d4caa54	tr	grammar-or-spelling
Bölgede yenilenen işbirliği çözüme katkıda bulunaabilir mi?	1c5acf73c4a9b45327fa6a8651a91768249bd8b1f567a75ec371f77f71d7af04	tr	grammar-or-spelling
Fakat Geoana kendinden emin görünüyor.	30715e633428b3cc12b1943ca9939345f019a54ca48ef3e42c54003fd6b2cf22	tr	difficult-pronounce
Korg .	56d1611eefa6edb35b117dbcae0847297789f3e3ea132dcb50265cc96a6e3450	tr	different-language
Fakat bu kurumda görev savcılar bulmak zor.	5911aba3b09d55d600510464d391e1090cd5d9577e9920cc012dca4660908463	tr	grammar-or-spelling
Nuremberg, Frankenstadion.	9efc84f9f6e50f42caf1307b718033729f7b7e214ac4554eb00cba8f1a1d7d4d	tr	different-language
Pensioners also lambasted the measures.	4218e5bfe721cc72d19566d30d41db27843d827d90f52d75752daffda59c160e	tr	different-language
Seçimler on dört Nisan Çarşamba günü yapılacak.	8caec421ad4611ca9b8e1c8efa5d79afe00ae686d28f0e24f2dedbcc016bd6e7	tr	offensive-language
Seçimler on dört Nisan Çarşamba günü yapılacak.	8caec421ad4611ca9b8e1c8efa5d79afe00ae686d28f0e24f2dedbcc016bd6e7	tr	different-language
Seçimler on dört Nisan Çarşamba günü yapılacak.	8caec421ad4611ca9b8e1c8efa5d79afe00ae686d28f0e24f2dedbcc016bd6e7	tr	grammar-or-spelling
Bulgaristan listede otuz üç. sırada yer aldı.	82b7da8b50cfb17bb6608f3e748bf1dfc302a23b5b222899ab31463f63222959	tr	grammar-or-spelling
Pek şimdi ne olacak?	8f86472d484c0ed9b6cac4818cbff8e9b5c6daa4a6adf57f69ece05f75abfef6	tr	grammar-or-spelling
Ülkede topla altı bin üç yüz bina sular altında kaldı.	7e1aef8533c0cef51f0f44233348dac9327adcf83a785f221d0d361b6c91e073	tr	grammar-or-spelling
Pensioners also lambasted the measures.	4218e5bfe721cc72d19566d30d41db27843d827d90f52d75752daffda59c160e	tr	different-language
Stamatis Kraounakis.	98b9b06df6f164ee7d27389549d03ce3fa2103d47434b5efcb13f14a48e7c802	tr	different-language
Akşama doğru kuzu hazır hale gelir.	ed6a1b386ee66831d5e58565d78538c4e035f6879b79a8c442a83b8ffbd8f9be	tr	difficult-pronounce
Bizim politikamız budur.	d39f4eee61b73df8daab2de4f4a95043b03875d7c2090c42cb81932552ccf01d	tr	difficult-pronounce
Etkinlik yedi Haziran'da sona erecek.	fec23f35ac1b53ae7ef151604fe9f8d5e1bd902140543e132fb478a235ca05b5	tr	difficult-pronounce
Daha iyi bir hayat düşünülemezdi.	bc39e5788bf61561ed7d5c17e6b9d89a13a4555ed6708d492e3f4d5d7b9b823e	tr	different-language
Daha iyi bir hayat düşünülemezdi.	bc39e5788bf61561ed7d5c17e6b9d89a13a4555ed6708d492e3f4d5d7b9b823e	tr	difficult-pronounce
Avrupa Komisyonu konuyu incelediğini söyledi.	e89e6f59379b25b25540a0305e28fced9859ad854b2c43103b1a81e597e72e23	tr	offensive-language
Güçlü patlama kentin büyük bölümünden işitildi.	cfed64a5f6e947e1b5f26c6710e122fdb502433fff4ccbcae8e8196ca09c8c19	tr	grammar-or-spelling
Paylaşma ve yoksullara yardım etme zamanıdır.	e7cf24523f5257362b475d660e61a05f75e6a034db1a8e6f819c36ecff302106	tr	offensive-language
Paylaşma ve yoksullara yardım etme zamanıdır.	e7cf24523f5257362b475d660e61a05f75e6a034db1a8e6f819c36ecff302106	tr	grammar-or-spelling
Paylaşma ve yoksullara yardım etme zamanıdır.	e7cf24523f5257362b475d660e61a05f75e6a034db1a8e6f819c36ecff302106	tr	different-language
Ancak, bu olumlu durum kısa sürede tersine dondu.	c6f4a20d9b494243120c7a07345690ff8592c3bf2f17a5e2928bee1890c89d97	tr	grammar-or-spelling
Planın ardından yatan mantık tam olarak nedir ve Yunanlıları uzun vadede nasıl etkileyecektir?	fa2d308141808bbb43acaed1f9acdb5c0c77e93c9a18aa9471df86ed8cb7c4e7	tr	grammar-or-spelling
Uydu yedi yüz yirmikm irtifada yörüngeye oturdu.	1ccee1a54a50fc470ada287f2a30e91785e6c6e2018fd595906f81a216620149	tr	grammar-or-spelling
Tutumların Avrupalı bir unsura rastlamadım.	1aa01776accecc4791c48014eaf05d049bcf88db30011fe18cd8b567b7ffd821	tr	grammar-or-spelling
Uiki bin dokuz yüz doksan yedi yılında Saraybosna'da çaldı.	24875df4fc45f22f17b828b1ed640676b8aacc4f9241853cef264ca2ffd62547	tr	grammar-or-spelling
Sektördeki resmi ortamala aylık iki yüz on bir avro.	e871bdc3f684eb7b3b2fd6397b790e8c71743e50c2351a95b1c263d6e9a9db1e	tr	grammar-or-spelling
Oyun, Balkanlarda yaşanan ihtilafi konu aliyor.	3c8821f8d8a6ff49d3d267f76c40bb4175fd95cd8a4aaef61f08cceddc57361b	tr	grammar-or-spelling
Pensioners also lambasted the measures.	4218e5bfe721cc72d19566d30d41db27843d827d90f52d75752daffda59c160e	tr	different-language
Uydu yedi yüz yirmikm irtifada yörüngeye oturdu.	1ccee1a54a50fc470ada287f2a30e91785e6c6e2018fd595906f81a216620149	tr	grammar-or-spelling
Bu toprakların özü İslam'la yoğrulmuştur.	4207b4d986417ec4e9875b02274d0ce47a805a94be85e021e19688fcd2ab6f4f	tr	difficult-pronounce
Muzar üç buçuk yıldır cemaatin bir üyesi.	187e7317008c142c63d621d7325b4c64da2bdb3f2d8951b114ec43d154f6670c	tr	different-language
Oyun, Balkanlarda yaşanan ihtilafi konu aliyor.	3c8821f8d8a6ff49d3d267f76c40bb4175fd95cd8a4aaef61f08cceddc57361b	tr	grammar-or-spelling
Allahverdi, örgütün ilk Türk üyesi oldu.	51d2cf1de486c67263db1d49cc0d78ce97c6c1c2259041f7da3c2854637d6cc0	tr	uydurma
Oyun, Balkanlarda yaşanan ihtilafi konu aliyor.	3c8821f8d8a6ff49d3d267f76c40bb4175fd95cd8a4aaef61f08cceddc57361b	tr	grammar-or-spelling
Oyun, Balkanlarda yaşanan ihtilafi konu aliyor.	3c8821f8d8a6ff49d3d267f76c40bb4175fd95cd8a4aaef61f08cceddc57361b	tr	grammar-or-spelling
Tum bu önerilerin sonucunu zaman gösterecek.	68e3f72549ca8e5963a2951ec259d20e286a6cff7e63f058c5ffcf9e5cef3400	tr	grammar-or-spelling
English görevi bu ay devralacak.	56e7344340ca1b27fc73fea40d376352259c9ac32cda526e5b23315e4d98a064	tr	different-language
Erdoğan'ın eşi de türban takıyor.	49271349b3ef7a09f144767e4628f88602e856aa4fb6cf8164628024faf38ad5	tr	Siyasi cümeler korkutuyor, ç?kar?lmal?, bir yerde kullan?labilir. Politic sentences should be removed.
Pensioners also lambasted the measures.	4218e5bfe721cc72d19566d30d41db27843d827d90f52d75752daffda59c160e	tr	different-language
Xhema ise Mabetex'in yönetim kurulu uyesi.	6ae3fcf2f458551567646d364f17a61aab3a484767a431842d3651028c6c131a	tr	different-language
Xhema ise Mabetex'in yönetim kurulu uyesi.	6ae3fcf2f458551567646d364f17a61aab3a484767a431842d3651028c6c131a	tr	different-language
Uydu yedi yüz yirmikm irtifada yörüngeye oturdu.	1ccee1a54a50fc470ada287f2a30e91785e6c6e2018fd595906f81a216620149	tr	grammar-or-spelling
Foruma dört yüzde fazla kişi katıldı.	3755cb7a61df0f474e3e6cf2cef5bb2381ea0d7ea4368163aaa750037b5cf164	tr	grammar-or-spelling
Oyun, Balkanlarda yaşanan ihtilafi konu aliyor.	3c8821f8d8a6ff49d3d267f76c40bb4175fd95cd8a4aaef61f08cceddc57361b	tr	grammar-or-spelling
Uydu yedi yüz yirmikm irtifada yörüngeye oturdu.	1ccee1a54a50fc470ada287f2a30e91785e6c6e2018fd595906f81a216620149	tr	grammar-or-spelling
Batiç ise herhangi bir dosya gördugunu reddetti.	629a6b334d82e5ea545b25764ae5278bac4c601ca53ce40b963297728ee34797	tr	grammar-or-spelling
Uydu yedi yüz yirmikm irtifada yörüngeye oturdu.	1ccee1a54a50fc470ada287f2a30e91785e6c6e2018fd595906f81a216620149	tr	grammar-or-spelling
Taliban'ın İstanbul adresi mi var?	7fcd8f93dc13d699a1ffd6d00e1d4354d222be8bb7319f90a8a5fecd772ee898	tr	Siyasi
Şu ânda durum nedir?	8215593135ac153e152917b3e0a58e9936f71c3f1b9173cdf5ee359ad1501885	tr	grammar-or-spelling
Batiç ise herhangi bir dosya gördugunu reddetti.	629a6b334d82e5ea545b25764ae5278bac4c601ca53ce40b963297728ee34797	tr	grammar-or-spelling
Batiç ise herhangi bir dosya gördugunu reddetti.	629a6b334d82e5ea545b25764ae5278bac4c601ca53ce40b963297728ee34797	tr	grammar-or-spelling
Ancak, bunun kolay olmayacagi belirtiliyor.	89e77fbfff5eaf9d29589aad177fdf18e3a814dac1e4b5a1f4edbc9e11f0bca6	tr	grammar-or-spelling
Batiç ise herhangi bir dosya gördugunu reddetti.	629a6b334d82e5ea545b25764ae5278bac4c601ca53ce40b963297728ee34797	tr	grammar-or-spelling
Oyun, Balkanlarda yaşanan ihtilafi konu aliyor.	3c8821f8d8a6ff49d3d267f76c40bb4175fd95cd8a4aaef61f08cceddc57361b	tr	grammar-or-spelling
Refah dönemi hemen yarım başlamayacak.	897fb859e9a657a0ff8bdc8d8508013621b47e946008fb56f90862592b99f639	tr	grammar-or-spelling
Buun nedenlerinden birisi trafik sorunuydu.	6693b45c8e9d77792861a8500cf7257cc4ac287e8c6737df6b712a3bf25e7415	tr	grammar-or-spelling
Kosova başkentinswki yolcu sayısı arttı.	99525c50e4094e7eb25be8901ad05a1d7c43b17fd2864d461da5258921e30f1d	tr	grammar-or-spelling
Kosova başkentinswki yolcu sayısı arttı.	99525c50e4094e7eb25be8901ad05a1d7c43b17fd2864d461da5258921e30f1d	tr	grammar-or-spelling
Port Elizabeth'e gittik.	f0c2393879f733ae0e6e2ac31e02ffee086b61c645e6134efe0cb32c3b492e0f	tr	different-language
Cortiç buna katılıyor.	b7dbd3b221fd1612c3889ee5bdb659bbaaad2b387c5dfae60c25b790b9eabde5	tr	offensive-language
Cortiç buna katılıyor.	b7dbd3b221fd1612c3889ee5bdb659bbaaad2b387c5dfae60c25b790b9eabde5	tr	grammar-or-spelling
Bdoksan iki bu açıdan hangi noktada duruyor?	bde974c8c96216656774ec6848c2f032e4020d1ecd922212c531f9c52dad4816	tr	grammar-or-spelling
Seydiu şimdi iki mevkiyi de kaybetti.	f3af7c33e89e55719e3b6a53137d5f73356668cf80fbf17e8d4d3af3e9adf2a3	tr	grammar-or-spelling
Seydiu şimdi iki mevkiyi de kaybetti.	f3af7c33e89e55719e3b6a53137d5f73356668cf80fbf17e8d4d3af3e9adf2a3	tr	difficult-pronounce
Halka açık sigara yerlerde sigara içmek mi?	15fe2959219f203eb080c689681f55ac529e78f3a76dcd6684a9d4f9d6519764	tr	grammar-or-spelling
Pensioners also lambasted the measures.	4218e5bfe721cc72d19566d30d41db27843d827d90f52d75752daffda59c160e	tr	different-language
Ancak reformu siyasi bağlamı pek dostça olmadı.	0d0920465e0b39a7f4a903c3dd64a290d11748239b268434fe36aa1a27c706c2	tr	grammar-or-spelling
Pensioners also lambasted the measures.	4218e5bfe721cc72d19566d30d41db27843d827d90f52d75752daffda59c160e	tr	different-language
Birini sınıf müfredatı hazırlık niteliğinde.	0f85be8c485be6ad9c0227f80965d18dabd565b7c0788c0bebfe41140c7b3653	tr	grammar-or-spelling
Pensioners also lambasted the measures.	4218e5bfe721cc72d19566d30d41db27843d827d90f52d75752daffda59c160e	tr	different-language
Polis en az altı kişiyi daha sorguya çekiyor.	ff673fe117773c486c536f87af0b9fd9748b75d19540b7427376899103bc1c75	tr	difficult-pronounce
Türk medyası da yasağa ateş püskürdü.	0e828a3c6fd86bed19aef1c143ed03d3d8988ef7cd1debbc4ecf96c363856f86	tr	difficult-pronounce
Bu, pek çok Balkan ülkesinin yaşadığı br sorun.	0d29aaa5d15c5b7412064f6d1c504d42dc5c2f4d9230faa6be121f847aecc87a	tr	grammar-or-spelling
Krstiç şu anda kırk altı yıllık hapis cezasını çekmekte.	254a048079379524de861427741da601c34c95d1654bf73d4627483984facf88	tr	different-language
Krstiç şu anda kırk altı yıllık hapis cezasını çekmekte.	254a048079379524de861427741da601c34c95d1654bf73d4627483984facf88	tr	difficult-pronounce
Pensioners also lambasted the measures.	4218e5bfe721cc72d19566d30d41db27843d827d90f52d75752daffda59c160e	tr	different-language
Hırvat takımı, jüri özel ödülünü de aldi.	42b9029d1b9f6dfa28ec634907acbf5824cee4cff486fae1d65a3696bea82a6b	tr	grammar-or-spelling
Teklif verme süresi altı Kasım'da sona ediyor.	253b445368657f3cd8b6bf6442b5e1334a4fbae80b8af2855c8089a8762c671f	tr	grammar-or-spelling
Batiç ise herhangi bir dosya gördugunu reddetti.	629a6b334d82e5ea545b25764ae5278bac4c601ca53ce40b963297728ee34797	tr	grammar-or-spelling
Bazı şeyleri değiştirmeye başlayan insanlar var.	145cd413d01e896ec0a0d8ba9da84df953d7bf88e2e6dd847b08c37634864e5c	tr	different-language
Turkiye, parlamenter sisteme bin dokuz yüz yirmi yılında geçti.	9b51b169327cd024d95e8051bcd7374047607bc65a9e28e6a2cb3050253a8de0	tr	grammar-or-spelling
Polis bu olayla ilgili ki şüpheliyi tutukladı.	8f1759962a4d32b4996032f83025071aa1b4af06afd6aa9e2e3591ac670a68a0	tr	grammar-or-spelling
Şu ânda durum nedir?	8215593135ac153e152917b3e0a58e9936f71c3f1b9173cdf5ee359ad1501885	tr	grammar-or-spelling
Steiner'ın yerine bir cok kisinin adi geciyor.	8c6598eeafe50c5ad5caf8e8ad3b39c662e5afd838bbffea189378ee4a45e8e9	tr	grammar-or-spelling
Pensioners also lambasted the measures.	4218e5bfe721cc72d19566d30d41db27843d827d90f52d75752daffda59c160e	tr	different-language
Slyivancanin ise hala kayıp.	9e1ce5a0636ce41555eb662972e8479f8cef639178dbf6ccf75b0f45d372c7b7	tr	difficult-pronounce
Slyivancanin ise hala kayıp.	9e1ce5a0636ce41555eb662972e8479f8cef639178dbf6ccf75b0f45d372c7b7	tr	Yabanci kelime
Pensioners also lambasted the measures.	4218e5bfe721cc72d19566d30d41db27843d827d90f52d75752daffda59c160e	tr	different-language
Neden hayat bu gittikçe daha pahalı hale geliyor?	aff14ef7225772b884f449a74508c1d32b304cb7b9a837b74cfa35bb07d5f4fa	tr	grammar-or-spelling
Dragnea'nın seçimi pek kişiye sürpriz oldu.	b12af7b999c66e3a4b3935a1ffb12d7afa46273c996ea37ac6178ca14ffa4ba7	tr	grammar-or-spelling
Tesisin inşaatı, dört buçuk yılda tamamlanancak.	b6f130c25a2fbca1132b88830d2de5b209d409802545c4bc412b7994cb4660cb	tr	grammar-or-spelling
Stamatis Kraounakis.	98b9b06df6f164ee7d27389549d03ce3fa2103d47434b5efcb13f14a48e7c802	tr	different-language
İki ülke bloğa yirmi altı ve yirmi yedi. üyeler olarak katıldı.	b91da54c4fbe929f55743b5c3ba39e09fd5adf16b15ef8ad31f35326dace170c	tr	grammar-or-spelling
Merwin oldu.	b84c883cb0fbcc61dcf480fc89998a8d0f0b76d448e0d132b0d89f5d924201c0	tr	different-language
İngiliz takımı toplamda altı. oldu.	abdd26104e0c803f8b3e9463d2335eb268527e7c8d7b9a362050ef83bc7caeed	tr	grammar-or-spelling
Bdoksan iki bu açıdan hangi noktada duruyor?	bde974c8c96216656774ec6848c2f032e4020d1ecd922212c531f9c52dad4816	tr	grammar-or-spelling
Çok az kişi mantıklı secenekler önerdi.	9345ce2dc41258d5db62b6686eccdd8a4281480ccbe8ec4f25885ddf4f582944	tr	grammar-or-spelling
Gemi seyahati düzenleyen şirketlerin, yeterli rıhtımı bile olmayan bir yeri niçin tercih etsin?	ae3040ef173a7d99544f9ff2933b0211a27ee1a444395d87e11a770a7efb2248	tr	grammar-or-spelling
Ancak bu iş şu ana kadar hiç de kolay gorunmuyor.	aa073ee6d2d5fc847a6fd2f8edceb8c020d772f4c49cd8e579f5995f22bd844b	tr	grammar-or-spelling
Bu süre icinde ne gibi başarılar elde edildi?	afec94ab0b0f7cb25903393b6d01eb5015faccba9c83238951681a781f7d0037	tr	grammar-or-spelling
Hak verilmeli ki, dünya çapındaki sorunlar aslında insan beyninin mekanizmaları hakkında bize oldukça aydınlatıyor.	b0d1b587b82f6c562724cc849a28bcc623378c4dde1eb9b24992b349e953984d	tr	grammar-or-spelling
Ancak, bu olumlu durum kısa sürede tersine dondu.	c6f4a20d9b494243120c7a07345690ff8592c3bf2f17a5e2928bee1890c89d97	tr	grammar-or-spelling
Ve Bayrami zamanın tükendiğini biliyor.	b1242f22b706ca31d5307ef45d33ff583d643721e0e35bf5b8471b7c50a6606f	tr	grammar-or-spelling
Bunun bir çeşit etnik temizlik olarak görüyor musunuz?	c0cfe9879db41a73c4f39782131f9bc8d0b9bd4d0bdf9e7330955e53d03037ec	tr	grammar-or-spelling
Mimari on dokuz. yüzyıl sonlarına oldukça benziyor.	cfb2f4d7e459100e82506830303659f9c935c8d007d54354b9b931f2b9740fd1	tr	grammar-or-spelling
Makedonya'nın Prilep kentinde düzenlenen otuz dört.	b25072f92772ef0cdb1a829ab0233930d9179a3220d85c63296ab05a58b5c22b	tr	grammar-or-spelling
Fakat anılarımızda yer almak için burada.	b911bf1eb3ecbdf578971792e83674e4c957d8214c799d55a35b623cb2b0e67b	tr	grammar-or-spelling
Sizce tarafların yakın bir gelecekte anlaşlamaya varmasını beklemek gerçekçi mi?	e46dda1281e4c6b5f8b832bed98daf252c1e717a9e6bd11fc499eca1c7dda81b	tr	grammar-or-spelling
Pensioners also lambasted the measures.	4218e5bfe721cc72d19566d30d41db27843d827d90f52d75752daffda59c160e	tr	different-language
Diğer partilerse açık farkla geriden geliyor.	dbe65009bc721c9afba275064e4766aca496bea1ed52ace52439d56de3dcdf1b	tr	grammar-or-spelling
Makedonya ise dokuzuncu Grupta üçüncü sırada yer alıyor.	dd07cfd929036ba8f769cb54acb00b2237c44114a72ffe9b38d9eee9d3e0d18b	tr	grammar-or-spelling
Bu süre icinde ne gibi başarılar elde edildi?	afec94ab0b0f7cb25903393b6d01eb5015faccba9c83238951681a781f7d0037	tr	grammar-or-spelling
Çinli Yibing Chen altında madalyanın sahibi oldu.	cf071b3088b236608340c33d56c04ddf82046007b9cf81b93ee84dfd5a72f364	tr	grammar-or-spelling
Erkeklerse Brezilya'yı iki-bir yendiler.	e03168e22a05d4d4ce5b08a2ca60e5a2e1675a5e31c4bd354963fd7ec655a3a5	tr	grammar-or-spelling
Makedonya, Moskova'da düzenlenecek yirmi üç.	ea56483a4f1b8b92c75752286e373f6ec75fbbbab991c4e619279dec96a2ab72	tr	grammar-or-spelling
Nuremberg, Frankenstadion.	9efc84f9f6e50f42caf1307b718033729f7b7e214ac4554eb00cba8f1a1d7d4d	tr	grammar-or-spelling
Rodos'a gidiş dönüş biletiyse adam başı iki yüz elli avro.	d87b6cd44769a701265bec6eab7986bca8d7be2b75c473fdc20e2b20c2e12c0d	tr	grammar-or-spelling
Hak verilmeli ki, dünya çapındaki sorunlar aslında insan beyninin mekanizmaları hakkında bize oldukça aydınlatıyor.	b0d1b587b82f6c562724cc849a28bcc623378c4dde1eb9b24992b349e953984d	tr	grammar-or-spelling
Franchini ölmedi.	f1d99f8dbe27d9a6cf9f409abd7b78e5289bb872148733fecd5c3eb0dd683201	tr	different-language
Çinli Yibing Chen altında madalyanın sahibi oldu.	cf071b3088b236608340c33d56c04ddf82046007b9cf81b93ee84dfd5a72f364	tr	grammar-or-spelling
Tam olarak itiraz ettiğini noktalar neler? Sizce yasanın olumlu yönleri de var mı?	d46cc82d0b4969b0448e725ca002d1dc4c0a9127b7145ce947dd85f7e28b0969	tr	grammar-or-spelling
Üsküp karar tepki göstemekte gecikmedi.	f5562bb0fa671f1a37ac228cd1a4754161d2353e6f4a68b8ccbb00a22d73fd4e	tr	grammar-or-spelling
Partinin hükümet gündemini sunmak.	e958ef6467264a44e5a103eea6c2082e03d79d8d578ce82eed81384cc4474f0b	tr	grammar-or-spelling
Sırbistan bu sorunlar nasıl başa çıkacak?	08e77e6018ca52435e5e342a57163f01f7cc1183eb569810b866df3891f02750	tr	grammar-or-spelling
Halka açık sigara yerlerde sigara içmek mi?	15fe2959219f203eb080c689681f55ac529e78f3a76dcd6684a9d4f9d6519764	tr	grammar-or-spelling
Fakat Stojarova'nın başka bir önerisi var.	fc7ca58a3f3efa6f0380ea2b4ea5ab46ecbf176c5160b21c1cbb9c3157ca7801	tr	different-language
Tutumların Avrupalı bir unsura rastlamadım.	1aa01776accecc4791c48014eaf05d049bcf88db30011fe18cd8b567b7ffd821	tr	grammar-or-spelling
Bugünlerde, Sighisoara popüler bir tatil beldesi.	0ac0f81d8c8402bff211934f321524dd0a12b87e0274fa0bbaa59863815edbdf	tr	different-language
Louka Katseli ekonomi bakanı olacak.	e83d759baa5781c2d33e6b539b9e1b52f26d2af0a1e266f167bbad5f264b3321	tr	different-language
Mahhemenin altı ay sürmesi bekleniyor.	15ed9f716915a81cc2033d925ddae80bf99f87c796db659a44fb93d26d4caa54	tr	grammar-or-spelling
Kalogeresis aynı fikirde değil.	fa9903ab509c31600c04671a3eaf33efb0ab70a9aa3cc49d57ca0601e4fa2722	tr	different-language
Bakarciev daha sonra olaydaki rolünü itiraf etti.	1ab383193536c8509b67f25144b6ffd6dc49818d8858bc15de986fce218464b9	tr	different-language
Bojaxhi'ye göre çeşitli yöntemler izlenmeli.	1488905da60611248d3d0fb1583e6666049afbc4675c992814a78ff9d10cfbc3	tr	different-language
Sibiu'nun kendine has bir ortaçağ havası var.	2401da728386b48762a71df8a6d38662cc4d545cef7e4b5b2a4ca00bad959c9f	tr	different-language
Pensioners also lambasted the measures.	4218e5bfe721cc72d19566d30d41db27843d827d90f52d75752daffda59c160e	tr	different-language
Snezana Pajkiç'in bugün nerede olduğunu biliyor musunuz?	2766044ec332390df5e932a6f838eb1632ae3889b25aa005cbfeda419935ff89	tr	difficult-pronounce
Burada çergilemek hiç de fena değildi.	0b5c09874c6b80c9b5febcd248c19b2c9c10232f5630fd1f8fb37ff64314147c	tr	grammar-or-spelling
Her zamanki gibi basit bir soğukalgınlığına benzemiyordu.	8be08837cf0f9b6838f5d46dc6036f246e66f9b5c6672a7746840685f2f7648c	tr	grammar-or-spelling
Mısır Kampanyası’nda için yedekte tutulmak üzere Aden'e taşındılar.	002dcd346d8288d0c0f0dbf696d4409145eaa805e87269ffd8277e6977a74fe7	tr	grammar-or-spelling
Morozane'nin Fujiwara no Moromichi ve Fujiwara no Ietada da dahil olmak üzere pek çok oğlu ve kızı vardı.	007a34172cd781b7906830eade8df51e2c26b510613698d53b8c987cf28780b4	tr	difficult-pronounce
Her iki mektup da transkriptleri ile birlikte learngaelic nokta net adresinde bulunabilir.	003a230a1810976135152f5148e3cf4aa41d8efab83c737a226edd40bc9fa614	tr	Unmeaningful URL
Söylendiğine göre, Fogerty "The Devil and Daniel Webster"ı izledikten sonra "Bad Moon Rising"i yazmış.	008cedcedc0ab427abfbe5527a8d75ed9a429e6a05b62c11cea019617332fe4c	tr	Many English words/Tittles
Oyun bu formda olduğunda beri emekli.	00005ef76c570bac3422522b5ff2f860b2b74bad30be94f717b85f24a1cc6379	tr	grammar-or-spelling
Tanınmış bir şarkı "Zindagi hai pyar se, pyar se bitaye ja"	00c9960fc05dc95859ba8b76bf8b456a34841e5555d94e82ee58c485a320ab4f	tr	different-language
Madox'un "History of the Exchequer"i eskiden standardı oluşturuyordu.	00dd24387ed56ee2c657f7de84803a3c35addd0b5aeb6e5e5fd4f1c644e070bb	tr	different-language
Maç bitince Knoble ve Karagias “Jung Dragons”a saldırdı.	00a093a0f41f41e15da917562423afbae47f0bcf08e7371e0ad9f3a2c3fe576b	tr	different-language
Ault ve ilk karısı Julie'nin iki çocuğu vardı.	00bba789d6d034e84d89a03edce56d766ad4ba535fa271dd8eec1a05e0d4003b	tr	different-language
Kuzeybatı Kıyısı, Okyanusya, Afrika ve Güney Amerika'dan gelen mükemmel holdingler var.	0024890b68b2ef18085a44a89765821bb2645ff00d21e1c8e64a7c4a8a4b8d16	tr	grammar-or-spelling
“mappiq”, hece bitişinin sessiz değil ünsüz olduğunu belirtir.	00ae41c3917e62739542c90a43205e11fef6172ea69b7d607b0953fb1a6ffb59	tr	different-language
Mülkiyet şimdi Baloga Funeral Home In mevkiindedir.	0069233404e4732febc9e81c0b709c10a79d198fe4f29a50b04b19e675f90027	tr	different-language
Fen-phen artık yaygın olarak mevcut değildir.	008d96e9f9fe3eae343b5c931611e94fe95c3d07e710482f746fd73d96ec207c	tr	different-language
Cotham, Bristol West parlamento seçim bölgelerinden biridir.	00c38078cc5cf8cdfe67fd54bb684b0bdde133a9c0331956fde27f317099dd4a	tr	different-language
Siebricht grubun kalıcı basçısı olacaktı.	009aa88dca49a82717fbd4caaab294c340ee011cacb7b0cf5d95f910c8ed47a6	tr	different-language
"P. nelsoni" Florida ve güney Georgia'da yaşar.	009f29fd5c0533ffb2c6d70661863eda2770d25856bdde83d32c0034fb86f103	tr	different-language
Bu, Phillips’e "The Geese and the Ghost" albümünü tamamlaması için gerekli itici gücü sağladı.	00e1d41c65272fc98a543d2d2b9441e050df7922becca97451f12f582ee7d8d2	tr	different-language
Andrew Fırtınasını gözetim altında tuttu neticeyi raporlarken sözüm ona yağmacıları kovaladı.	00cf42bd74c1a734d2a13c11d69db4ccd7d4045ddbf2bc787c7412621da8f406	tr	grammar-or-spelling
Piskoposun evi Bishop's House, Gosforth'tur.	0093d5f7b2555c4845856cec57501ea3c0c4450ecf996c4d9f0dfef2eb3a709c	tr	different-language
"Carne seca", Tucson ve Sonora'daki machaca için alternatif bir isimdir.	0072c778b691bd05d48cc65bf57259ea201686ba73d11070750b8ca94d84282d	tr	grammar-or-spelling
"Carne seca", Tucson ve Sonora'daki machaca için alternatif bir isimdir.	0072c778b691bd05d48cc65bf57259ea201686ba73d11070750b8ca94d84282d	tr	different-language
Norveç'te alternatif ancak daha az yaygın olan bir "Rolf" varyasyonu "Rolv" şeklindedir.	00d455fbea989a537ee1f413604edb853589753a1691ec4449cafa8434eccf6e	tr	difficult-pronounce
Bu kahramanlar, Earth-S olarak bilinen bir paralel evrende yaşar.	006125eac9de1580bb88e964934fc1732e7143332707916dcc69b6ff35c026c9	tr	difficult-pronounce
Tasarım başpiskopos Dom Jaime Luiz Coelho tarafından idealleştirildi.	008c0a5655c8587b136cfd9e98a526e2fca19ff5d1aa1fefb47b60435160978a	tr	difficult-pronounce
Aitken, Chatham Belediye Meclisi’nde Bennett'in başarılı yer kazanma kampanyasını yürüttü.	00c2fcd17b0d0e7762573cf095567808c89946c908ba21e2da575a2c920d2e9d	tr	difficult-pronounce
Bunu görünce yüzünde bir teşekkür dolaştı ve yanıma oturdu.	0c56ae788e2cdc1185f7bddde83aed92e5a5c03238296611ef3503d55cd80846	tr	grammar-or-spelling
Diyiversene, ha!	0fe7d46a9fda9e11ba1d856e16c4be772d87a8553b9d6b6f5eb23fba30c92654	tr	grammar-or-spelling
Memleketten gelip şehirde yerleşmiş, oldukça hali vakti yerinde bir dayısı vardı.	09a93dbe7f3c7822c4d814d87d5cf42c06a50c2acd5c19ed92e8d271ec733496	tr	grammar-or-spelling
Bugün burda, yarın orda amelelik yapıyordu.	0f21c3ec5324da1ee97973f5e6ee0947d4c477d81308fc2718d203cdf236080e	tr	grammar-or-spelling
Şoför ve muavini motör kapaklarını açtılar.	038fa0b04fa2920c66a25a4ec58a6a7890d3822491b62fc9a798f93cdd0bcdf5	tr	grammar-or-spelling
Nesine acırsın yabanın katilinin?	0148f452455cdf275414d2b9fbfe03878f6bcc3d4fbba1ecdea177a447021995	tr	grammar-or-spelling
Fakat seferberlik çıkınca işler karıştı, tekrar askere istediler.	03666bf66c136be84e47be122ee4acfdf6826fbb788869e460f65300d9d05e78	tr	grammar-or-spelling
Yakası ve kolları siyah kadifeli düz bir mantosu vardı.	16afea5bcd40a78746d7bea4fff72440c025837b8a94ed7030451ff05f68b97f	tr	grammar-or-spelling
Şoför ve muavini motör kapaklarını açtılar.	038fa0b04fa2920c66a25a4ec58a6a7890d3822491b62fc9a798f93cdd0bcdf5	tr	grammar-or-spelling
Tesekkürler.	0ebd8f2abf2226e9722a295b15ad9ae07dc5689f19b494d61b9b2631d675e493	tr	grammar-or-spelling
Bunu bir hastalık kaprisi saydım; fakat cevap vermedim.	059e6268e543db8c2e9b11230c26aff85583f77fa6c595c1eb1e35f17bc4c305	tr	grammar-or-spelling
Omuzuma bir gece kuşu gibi konduğu zaman korkuyla bağırdım ve silkindim.	0f673e30467f49704579de398384cecc550ebf01878aa8df1aa42e72c4ab7879	tr	grammar-or-spelling
"Birde para mı istiyorsun?" diyerek apartmanın köşesindeki ufak kapıdan içeri girdi.	025e86dc2f67783f339108f4423bde115b3438923169953e09c48f52580e8787	tr	grammar-or-spelling
